{
  "schemaVersion": "0.1",
  "family": {
    "name": "Wardrobe_3Bay_2400x600x2200",
    "category": "Furniture",
    "hosting": "NonHosted",
    "units": "mm",
    "description": "Three-bay wardrobe with drawers, shelving, rail bay, and simple front doors.",
    "sourceType": "mixed"
  },
  "parameters": [
    {
      "name": "Width",
      "dataType": "length",
      "value": 2400,
      "group": "Dimensions",
      "isInstance": false,
      "source": "provided"
    },
    {
      "name": "Depth",
      "dataType": "length",
      "value": 600,
      "group": "Dimensions",
      "isInstance": false,
      "source": "provided"
    },
    {
      "name": "Height",
      "dataType": "length",
      "value": 2200,
      "group": "Dimensions",
      "isInstance": false,
      "source": "provided"
    },
    {
      "name": "Panel Thickness",
      "dataType": "length",
      "value": 18,
      "group": "Construction",
      "isInstance": false,
      "source": "defaulted"
    },
    {
      "name": "Cabinet Material",
      "dataType": "material",
      "value": "Grey Laminate",
      "group": "Materials and Finishes",
      "isInstance": false,
      "source": "defaulted"
    },
    {
      "name": "Handle Material",
      "dataType": "material",
      "value": "Dark Metal",
      "group": "Materials and Finishes",
      "isInstance": false,
      "source": "defaulted"
    }
  ],
  "referencePlanes": [
    {
      "name": "Left",
      "orientation": "leftRight",
      "offset": 0,
      "isStrongReference": true
    },
    {
      "name": "Right",
      "orientation": "leftRight",
      "offset": "Width",
      "isStrongReference": true
    },
    {
      "name": "Front",
      "orientation": "frontBack",
      "offset": 0,
      "isStrongReference": true
    },
    {
      "name": "Back",
      "orientation": "frontBack",
      "offset": "Depth",
      "isStrongReference": true
    },
    {
      "name": "Bottom",
      "orientation": "vertical",
      "offset": 0,
      "isStrongReference": true
    },
    {
      "name": "Top",
      "orientation": "vertical",
      "offset": "Height",
      "isStrongReference": true
    },
    {
      "name": "Bay 1 Divider",
      "orientation": "leftRight",
      "offset": 800,
      "isStrongReference": false
    },
    {
      "name": "Bay 2 Divider",
      "orientation": "leftRight",
      "offset": 1400,
      "isStrongReference": false
    }
  ],
  "materials": [
    {
      "name": "Grey Laminate",
      "color": "#B8B8B8",
      "parameterName": "Cabinet Material"
    },
    {
      "name": "Dark Metal",
      "color": "#303030",
      "parameterName": "Handle Material"
    }
  ],
  "geometry": [
    {
      "id": "outer_case",
      "type": "rectangularExtrusion",
      "name": "Outer Cabinet Mass",
      "subcategory": "Casework Panels",
      "material": "Grey Laminate",
      "origin": { "x": 0, "y": 0, "z": 0 },
      "dimensions": { "width": "Width", "depth": "Depth", "height": "Height" },
      "visible": true,
      "notes": "MVP represents the cabinet as a native rectangular extrusion. Panelized construction should replace this in Phase 2."
    },
    {
      "id": "left_door_1",
      "type": "rectangularExtrusion",
      "name": "Left Door A",
      "subcategory": "Doors",
      "material": "Grey Laminate",
      "origin": { "x": 0, "y": -20, "z": 720 },
      "dimensions": { "width": 390, "depth": 20, "height": 1260 },
      "visible": true,
      "notes": "Door added from design revision request."
    },
    {
      "id": "left_door_2",
      "type": "rectangularExtrusion",
      "name": "Left Door B",
      "subcategory": "Doors",
      "material": "Grey Laminate",
      "origin": { "x": 390, "y": -20, "z": 720 },
      "dimensions": { "width": 390, "depth": 20, "height": 1260 },
      "visible": true,
      "notes": "Door added from design revision request."
    },
    {
      "id": "door_handle_a",
      "type": "rectangularExtrusion",
      "name": "Door Handle A",
      "subcategory": "Hardware",
      "material": "Dark Metal",
      "origin": { "x": 365, "y": -45, "z": 1150 },
      "dimensions": { "width": 20, "depth": 25, "height": 260 },
      "visible": true,
      "notes": "Simplified rectangular handle."
    },
    {
      "id": "door_handle_b",
      "type": "rectangularExtrusion",
      "name": "Door Handle B",
      "subcategory": "Hardware",
      "material": "Dark Metal",
      "origin": { "x": 405, "y": -45, "z": 1150 },
      "dimensions": { "width": 20, "depth": 25, "height": 260 },
      "visible": true,
      "notes": "Simplified rectangular handle."
    }
  ],
  "constraints": [
    {
      "type": "formula",
      "target": "Right",
      "expression": "Width"
    },
    {
      "type": "formula",
      "target": "Back",
      "expression": "Depth"
    },
    {
      "type": "formula",
      "target": "Top",
      "expression": "Height"
    }
  ],
  "assumptions": [
    "Panel thickness defaulted to 18 mm.",
    "Door and handle locations are approximate and should be reviewed against final design intent.",
    "The MVP geometry intentionally simplifies panelized construction into rectangular extrusions."
  ],
  "clarifyingQuestions": [
    "Should the outer cabinet be modeled as separate panels instead of a solid mass?",
    "Should drawers and shelves be individually parameterized?",
    "Are door handles required as separate hardware subcategory geometry?"
  ],
  "qa": {
    "status": "needs_review",
    "warnings": [
      "Some dimensions are inferred from the visual reference.",
      "MVP geometry is not yet fully panelized.",
      "Family should be flex-tested after build."
    ]
  }
}

